{"targetId":"target-001","targetAddress":"0x1111111111111111111111111111111111111111","cachedOwner":"0x2222222222222222222222222222222222222222","assuranceState":"NORMAL","activePolicyKey":"policy-001-v1","policyGeneration":1,"authorityRevoked":false,"humanOverrideEnabled":true,"registeredAt":"2026-08-01T00:00:00Z"}
